{
  "$schema": "../../../../schemas/trial.schema.json",
  "mapId": "police-station",
  "trialId": "kill-the-snitch",
  "floors": [
    {
      "index": -1,
      "name": "Underground"
    },
    {
      "index": 0,
      "name": "First Floor"
    },
    {
      "index": 1,
      "name": "Second Floor"
    },
    {
      "index": 2,
      "name": "Third Floor"
    },
    {
      "index": 3,
      "name": "Fourth Floor"
    }
  ],
  "filters": [
    {
      "id": "enemies",
      "name": "Enemies",
      "categories": [
        "enemy"
      ],
      "default": true
    },
    {
      "id": "keys",
      "name": "Keys & Locks",
      "categories": [
        "key"
      ],
      "default": true
    },
    {
      "id": "doors",
      "name": "Doors & Stairs",
      "categories": [
        "door",
        "stairs"
      ],
      "default": true
    },
    {
      "id": "objectives",
      "name": "Objectives",
      "categories": [
        "objective"
      ],
      "default": true
    },
    {
      "id": "items",
      "name": "Items",
      "categories": [
        "item"
      ],
      "default": true
    },
    {
      "id": "gas-cans",
      "name": "Gas Cans",
      "categories": [
        "gas-can"
      ],
      "default": true
    },
    {
      "id": "generators",
      "name": "Generators",
      "categories": [
        "generator"
      ],
      "default": true
    },
    {
      "id": "record-boxes",
      "name": "Record Boxes",
      "categories": [
        "record-box"
      ],
      "default": true
    },
    {
      "id": "posters",
      "name": "Posters",
      "categories": [
        "poster"
      ],
      "default": true
    }
  ],
  "rooms": [
    {
      "id": "room-0001",
      "floor": 0,
      "zone": "standard",
      "shape": {
        "origin": [
          100,
          650
        ],
        "path": "h50 v-30 h-50 v30 z"
      }
    },
    {
      "id": "room-0002",
      "floor": 0,
      "zone": "standard",
      "shape": {
        "origin": [
          110,
          650
        ],
        "path": "v45 h30 v-45 h-30 z"
      }
    },
    {
      "id": "room-0003",
      "floor": 0,
      "zone": "standard",
      "shape": {
        "origin": [
          96.875,
          620
        ],
        "path": "h-10.625 h-31.875 h-37.187 v30 h-37.187 v-50 v-50 h74.375 v-10 h31.875 v10 h10.625 v-5 h5.313 l47.813,40 v35 z"
      }
    },
    {
      "id": "room-0004",
      "floor": 0,
      "zone": "standard",
      "shape": {
        "origin": [
          90,
          620
        ],
        "path": "v-20 h-30 v20 h30 z"
      }
    },
    {
      "id": "room-0005",
      "floor": 0,
      "zone": "standard",
      "shape": {
        "origin": [
          60,
          600
        ],
        "path": "v-5 h-10 v5 h-10 v-5 h-10 v25 h30 z"
      }
    },
    {
      "id": "room-0006",
      "floor": 0,
      "zone": "standard",
      "shape": {
        "origin": [
          115,
          555
        ],
        "path": "l-10,10 l10,10 l10,-10 z"
      }
    },
    {
      "id": "room-0007",
      "floor": 0,
      "zone": "standard",
      "shape": {
        "origin": [
          -20,
          550
        ],
        "path": "h-35 v50 h35 v-50 z"
      }
    },
    {
      "id": "room-0008",
      "floor": 0,
      "zone": "standard",
      "shape": {
        "origin": [
          -35,
          600
        ],
        "path": "v-10 h15 v10 h-10 z"
      }
    },
    {
      "id": "room-0009",
      "floor": 0,
      "zone": "standard",
      "shape": {
        "origin": [
          90,
          550
        ],
        "path": "v-20 h10 v20 h-10 z"
      },
      "info": {
        "title": "The track"
      }
    },
    {
      "id": "room-0010",
      "floor": 0,
      "zone": "standard",
      "shape": {
        "origin": [
          103.33333333333333,
          530
        ],
        "path": "h6.667 v-15 h-20 v15 z"
      },
      "info": {
        "title": "Broom Closet"
      }
    },
    {
      "id": "room-0011",
      "floor": 0,
      "zone": "standard",
      "shape": {
        "origin": [
          60,
          540
        ],
        "path": "v-30 h30 v30 h-30 z"
      }
    },
    {
      "id": "room-0012",
      "floor": 0,
      "zone": "standard",
      "shape": {
        "origin": [
          20,
          550
        ],
        "path": "h40 v-80 h-40 v80 z"
      },
      "wallGaps": [
        {
          "edge": 1,
          "start": 51,
          "length": 8
        },
        {
          "edge": 1,
          "start": 41,
          "length": 8
        },
        {
          "edge": 1,
          "start": 46,
          "length": 8
        },
        {
          "edge": 1,
          "start": 71,
          "length": 8
        },
        {
          "edge": 1,
          "start": 66,
          "length": 8
        },
        {
          "edge": 1,
          "start": 61,
          "length": 8
        },
        {
          "edge": 1,
          "start": 61,
          "length": 8
        },
        {
          "edge": 1,
          "start": 61,
          "length": 8
        },
        {
          "edge": 1,
          "start": 61,
          "length": 8
        },
        {
          "edge": 1,
          "start": 61,
          "length": 8
        },
        {
          "edge": 1,
          "start": 61,
          "length": 8
        }
      ],
      "info": {
        "title": "Lobby"
      }
    },
    {
      "id": "room-0013",
      "floor": 0,
      "zone": "standard",
      "shape": {
        "origin": [
          -20,
          550
        ],
        "path": "v-20 h13.333 v5 h26.667 v15 z"
      }
    },
    {
      "id": "room-0014",
      "floor": 0,
      "zone": "standard",
      "shape": {
        "origin": [
          18,
          535
        ],
        "path": "l7,-5 v-40 l-7,-5 h-28 v50 z"
      },
      "info": {
        "title": "Security Room"
      }
    },
    {
      "id": "room-0016",
      "floor": 0,
      "zone": "standard",
      "shape": {
        "origin": [
          120,
          470
        ],
        "path": "h-30 v40 h30 z"
      },
      "info": {
        "title": "WC 2"
      }
    },
    {
      "id": "room-0017",
      "floor": 0,
      "zone": "standard",
      "shape": {
        "origin": [
          90,
          450
        ],
        "path": "v-35 h30 v35 z"
      },
      "info": {
        "title": "WC 1"
      }
    },
    {
      "id": "room-0018",
      "floor": 0,
      "zone": "standard",
      "shape": {
        "origin": [
          110,
          470
        ],
        "path": "v10 h10 v-10 z"
      }
    },
    {
      "id": "room-0019",
      "floor": 0,
      "zone": "standard",
      "shape": {
        "origin": [
          110,
          480
        ],
        "path": "v10 h10 v-10 z"
      }
    },
    {
      "id": "room-0020",
      "floor": 0,
      "zone": "standard",
      "shape": {
        "origin": [
          110,
          440
        ],
        "path": "v30 h10 v-30 z"
      }
    },
    {
      "id": "room-0021",
      "floor": 0,
      "zone": "standard",
      "shape": {
        "origin": [
          110,
          440
        ],
        "path": "v-10 h10 v10 z"
      }
    },
    {
      "id": "room-0023",
      "floor": 0,
      "zone": "standard",
      "shape": {
        "origin": [
          60,
          470
        ],
        "path": "v-25 h-40 v25 h40 v-5 z"
      },
      "wallGaps": [
        {
          "edge": 2,
          "start": 1,
          "length": 14
        },
        {
          "edge": 2,
          "start": 11,
          "length": 8
        },
        {
          "edge": 2,
          "start": 16,
          "length": 8
        }
      ]
    },
    {
      "id": "room-0024",
      "floor": 0,
      "zone": "standard",
      "shape": {
        "origin": [
          20,
          445
        ],
        "path": "v-30 h35 h5 v30 z"
      },
      "info": {
        "title": "Conference Room"
      }
    },
    {
      "id": "room-0025",
      "floor": 0,
      "zone": "standard",
      "shape": {
        "origin": [
          -10,
          485
        ],
        "path": "v-5 h-5 v-95 h105 v125 h-30 v-95 h-40 v70 z"
      },
      "wallGaps": [
        {
          "edge": 6,
          "start": 31,
          "length": 8
        },
        {
          "edge": 6,
          "start": 26,
          "length": 8
        },
        {
          "edge": 6,
          "start": 6,
          "length": 8
        },
        {
          "edge": 6,
          "start": 1,
          "length": 8
        },
        {
          "edge": 6,
          "start": 6,
          "length": 8
        },
        {
          "edge": 8,
          "start": 46,
          "length": 8
        },
        {
          "edge": 8,
          "start": 41,
          "length": 8
        },
        {
          "edge": 8,
          "start": 31,
          "length": 9
        },
        {
          "edge": 8,
          "start": 36,
          "length": 8
        },
        {
          "edge": 8,
          "start": 36,
          "length": 8
        },
        {
          "edge": 8,
          "start": 36,
          "length": 8
        }
      ]
    },
    {
      "id": "room-0026",
      "floor": 0,
      "zone": "standard",
      "shape": {
        "origin": [
          -15,
          390
        ],
        "path": "h-20 v91.2 v4.8 h5 v24 h20 v-28.8 h-5 z"
      },
      "wallGaps": [
        {
          "edge": 5,
          "start": 5,
          "length": 14
        },
        {
          "edge": 5,
          "start": 11,
          "length": 8
        }
      ]
    },
    {
      "id": "room-0027",
      "floor": 0,
      "zone": "standard",
      "shape": {
        "origin": [
          -25,
          530
        ],
        "path": "h5 v20 h-20 v-20 z"
      },
      "info": {
        "title": "The Snitch"
      },
      "wallGaps": [
        {
          "edge": 4,
          "start": 1,
          "length": 8
        },
        {
          "edge": 4,